{
  "apiVersion": "ci.movie-platform.dev/v1alpha3",
  "kind": "ComponentCandidateEvidence",
  "component": "recommendation-mcp",
  "source": {
    "repository": "movie-reservation-platform-lab/movie-recommendation-mcp",
    "revision": "bbbbbbbbbbbbbbbbbbbbbbbbbbbbbbbbbbbbbbbb",
    "ref": "refs/heads/main"
  },
  "workflow": {
    "path": ".github/workflows/ci.yml",
    "job": "publish immutable GHCR image",
    "runId": "123",
    "runAttempt": 1,
    "url": "https://github.com/movie-reservation-platform-lab/movie-recommendation-mcp/actions/runs/123/attempts/1"
  },
  "candidate": {
    "repository": "ghcr.io/movie-reservation-platform-lab/movie-recommendation-mcp",
    "digest": "sha256:aaaaaaaaaaaaaaaaaaaaaaaaaaaaaaaaaaaaaaaaaaaaaaaaaaaaaaaaaaaaaaaa",
    "platform": {
      "os": "linux",
      "architecture": "amd64"
    }
  },
  "provenance": {
    "subjectName": "ghcr.io/movie-reservation-platform-lab/movie-recommendation-mcp",
    "subjectDigest": "sha256:aaaaaaaaaaaaaaaaaaaaaaaaaaaaaaaaaaaaaaaaaaaaaaaaaaaaaaaaaaaaaaaa",
    "predicateType": "https://slsa.dev/provenance/v1",
    "attestationId": "456",
    "attestationUrl": "https://github.com/movie-reservation-platform-lab/movie-recommendation-mcp/attestations/456",
    "bundle": {
      "path": "security-evidence/recommendation-mcp-provenance.json",
      "sha256": "sha256:cccccccccccccccccccccccccccccccccccccccccccccccccccccccccccccccc",
      "format": "sigstore-bundle-json"
    }
  },
  "securityEvidence": {
    "artifactName": "recommendation-mcp-security-evidence-123-attempt-1",
    "sbom": {
      "path": "security-evidence/recommendation-mcp.cdx.json",
      "sha256": "sha256:dddddddddddddddddddddddddddddddddddddddddddddddddddddddddddddddd",
      "format": "cyclonedx-json"
    },
    "vulnerabilities": {
      "path": "security-evidence/recommendation-mcp-vulnerabilities.json",
      "sha256": "sha256:f99fdd6a14d50135fdfa925edef5b9fea28c316e2eec48d78bdcf7ffe8ccefe6",
      "format": "trivy-json",
      "subject": "ghcr.io/movie-reservation-platform-lab/movie-recommendation-mcp@sha256:aaaaaaaaaaaaaaaaaaaaaaaaaaaaaaaaaaaaaaaaaaaaaaaaaaaaaaaaaaaaaaaa",
      "counts": {
        "unknown": 0,
        "low": 0,
        "medium": 0,
        "high": 1,
        "critical": 1
      }
    },
    "vulnerabilityPolicy": {
      "source": {
        "repository": "movie-reservation-platform-lab/movie-platform-actions",
        "revision": "eeeeeeeeeeeeeeeeeeeeeeeeeeeeeeeeeeeeeeee"
      },
      "reportSha256": "sha256:f99fdd6a14d50135fdfa925edef5b9fea28c316e2eec48d78bdcf7ffe8ccefe6",
      "evaluation": {
        "evaluatedAt": "2026-09-11T00:00:00Z",
        "mode": "approved-exemptions",
        "subject": "ghcr.io/movie-reservation-platform-lab/movie-recommendation-mcp@sha256:aaaaaaaaaaaaaaaaaaaaaaaaaaaaaaaaaaaaaaaaaaaaaaaaaaaaaaaaaaaaaaaa",
        "counts": {
          "unknown": 0,
          "low": 0,
          "medium": 0,
          "high": 1,
          "critical": 1
        },
        "exempted": {
          "notAffected": 1,
          "riskAccepted": 0
        },
        "blockingCritical": 0,
        "result": "passed-with-exemptions",
        "findings": [
          {
            "pointer": "/Results/0/Vulnerabilities/0",
            "vulnerabilityId": "CVE-2099-10001",
            "package": {
              "name": "example-lib",
              "version": "1.2.3-1",
              "purl": "pkg:deb/debian/example-lib@1.2.3-1?arch=amd64&distro=debian-12"
            },
            "severity": "CRITICAL",
            "disposition": "not-affected",
            "exemptionId": "EX-SYNTHETIC-001"
          },
          {
            "pointer": "/Results/0/Vulnerabilities/1",
            "vulnerabilityId": "CVE-2099-10002",
            "package": {
              "name": "example-lib",
              "version": "1.2.3-1",
              "purl": "pkg:deb/debian/example-lib@1.2.3-1?arch=amd64&distro=debian-12"
            },
            "severity": "HIGH",
            "disposition": "non-blocking",
            "exemptionId": null
          }
        ],
        "exemptions": [
          {
            "record": {
              "apiVersion": "ci.movie-platform.dev/exemptions/v1alpha1",
              "id": "EX-SYNTHETIC-001",
              "component": "recommendation-mcp",
              "type": "not-affected",
              "package": {
                "name": "example-lib",
                "version": "1.2.3-1",
                "purl": "pkg:deb/debian/example-lib@1.2.3-1?arch=amd64&distro=debian-12"
              },
              "platform": {
                "os": "linux",
                "architecture": "amd64"
              },
              "owner": "fixture-service-owner",
              "createdAt": "2026-09-01T00:00:00Z",
              "approval": {
                "by": "fixture-approver",
                "at": "2026-09-01T00:00:00Z",
                "reference": "https://github.com/movie-reservation-platform-lab/movie-platform-actions/pull/123"
              },
              "expiresAt": "2026-11-30T00:00:00Z",
              "rationale": "Synthetic decision for offline tests; not a real approval.",
              "references": [
                "https://example.org/advisories/CVE-2099-10001"
              ],
              "vex": {
                "@context": "https://openvex.dev/ns/v0.2.0",
                "@id": "urn:movie-platform:exemption:EX-SYNTHETIC-001",
                "author": "fixture-approver",
                "timestamp": "2026-09-01T00:00:00Z",
                "version": 1,
                "statements": [
                  {
                    "vulnerability": {
                      "name": "CVE-2099-10001"
                    },
                    "products": [
                      {
                        "@id": "https://github.com/movie-reservation-platform-lab/movie-recommendation-mcp",
                        "subcomponents": [
                          {
                            "@id": "pkg:deb/debian/example-lib@1.2.3-1?arch=amd64&distro=debian-12"
                          }
                        ]
                      }
                    ],
                    "status": "not_affected",
                    "justification": "vulnerable_code_not_present",
                    "impact_statement": "Synthetic fixture only: reviewed build omits the affected code."
                  }
                ]
              }
            },
            "sha256": "sha256:c466471564b74834477b9ae97c80532b92b920e5cf137d9d23a7f85849ef5c6d"
          }
        ],
        "warnings": [
          {
            "code": "exemption-applied",
            "exemptionId": "EX-SYNTHETIC-001"
          }
        ]
      }
    }
  },
  "generatedAt": "2026-09-11T00:00:00Z"
}
